{
  "name": "alberto-marketplace",
  "owner": {
    "name": "Alberto Leal",
    "email": "mail4alberto@gmail.com"
  },
  "metadata": {
    "description": "Personal marketplace for custom skills and plugins",
    "version": "0.58.0"
  },
  "plugins": [
    {
      "name": "skill-creator",
      "version": "2.0.0",
      "source": "./plugins/skill-creator",
      "description": "Create new skills, modify and improve existing skills, and measure skill performance. Use when users want to create a skill from scratch, update or optimize an existing skill, run evals to test a skill, benchmark skill performance with variance analysis, or optimize a skill's description for better triggering accuracy.",
      "author": {
        "name": "Anthropic"
      },
      "repository": "https://github.com/anthropics/skills/tree/main/skill-creator",
      "license": "Apache-2.0",
      "keywords": [
        "skills",
        "development",
        "creation",
        "tooling"
      ],
      "strict": false,
      "skills": [
        "./skills"
      ]
    },
    {
      "name": "git-absorb",
      "version": "1.1.0",
      "source": "./plugins/git-absorb",
      "description": "Automatically fold uncommitted changes into appropriate commits. Use for applying review feedback and maintaining atomic commit history.",
      "author": {
        "name": "Alberto Leal"
      },
      "repository": "https://github.com/dashed/claude-marketplace/tree/master/plugins/git-absorb",
      "license": "MIT",
      "keywords": [
        "git",
        "workflow",
        "commits",
        "rebase",
        "fixup"
      ],
      "strict": false,
      "skills": [
        "./skills"
      ]
    },
    {
      "name": "tmux",
      "version": "1.5.0",
      "source": "./plugins/tmux",
      "description": "Remote control tmux sessions for interactive CLIs (python, gdb, etc.) by sending keystrokes and scraping pane output. Use when debugging applications, running interactive REPLs (Python, gdb, ipdb, psql, mysql, node), automating terminal workflows, or when user mentions tmux, debugging, or interactive shells.",
      "author": {
        "name": "Alberto Leal"
      },
      "repository": "https://github.com/dashed/claude-marketplace/tree/master/plugins/tmux",
      "license": "Vibecoded",
      "keywords": [
        "tmux",
        "terminal",
        "multiplexer",
        "interactive",
        "debugging",
        "repl"
      ],
      "strict": false,
      "skills": [
        "./skills"
      ]
    },
    {
      "name": "skill-reviewer",
      "version": "1.1.0",
      "source": "./plugins/skill-reviewer",
      "description": "Review and ensure skills maintain high quality standards. Use when creating new skills, updating existing skills, or auditing skill quality. Checks for progressive disclosure, mental model shift, appropriate scope, and documentation clarity.",
      "author": {
        "name": "Alberto Leal"
      },
      "repository": "https://github.com/dashed/claude-marketplace/tree/master/plugins/skill-reviewer",
      "license": "MIT",
      "keywords": [
        "skills",
        "quality",
        "review",
        "audit",
        "documentation",
        "best-practices"
      ],
      "strict": false,
      "skills": [
        "./skills"
      ]
    },
    {
      "name": "agent-skill-init",
      "version": "1.0.0",
      "source": "./plugins/agent-skill-init",
      "description": "Create a repo-local Agent Skill following the open agentskills.io specification. Use when the user wants to create, scaffold, or initialize a new skill in the current repo, mentions a 'repo-local skill' or the agentskills.io spec, or needs a spec-compliant SKILL.md placed under .agents/skills/ (or .claude/skills/). Scaffolds the directory, writes valid name/description frontmatter, and validates with skills-ref.",
      "author": {
        "name": "Alberto Leal"
      },
      "repository": "https://github.com/dashed/claude-marketplace/tree/master/plugins/agent-skill-init",
      "license": "MIT",
      "keywords": [
        "skills",
        "agentskills",
        "scaffold",
        "spec",
        "repo-local",
        "skill-md"
      ],
      "strict": false,
      "skills": [
        "./skills"
      ]
    },
    {
      "name": "ultrathink",
      "version": "1.1.3",
      "source": "./plugins/ultrathink",
      "description": "Invoke deep sequential thinking for complex problem-solving. Use when the user says 'use ultrathink', 'ultrathink', or when tackling problems that require careful step-by-step reasoning, planning, hypothesis generation, or multi-step analysis.",
      "author": {
        "name": "Alberto Leal"
      },
      "repository": "https://github.com/dashed/claude-marketplace/tree/master/plugins/ultrathink",
      "license": "MIT",
      "keywords": [
        "thinking",
        "reasoning",
        "sequential",
        "planning",
        "analysis",
        "problem-solving"
      ],
      "strict": false,
      "skills": [
        "./skills"
      ]
    },
    {
      "name": "conventional-commits",
      "version": "1.0.0",
      "source": "./plugins/conventional-commits",
      "description": "Format git commit messages following Conventional Commits 1.0.0 specification. Use when the user asks to commit changes, create a git commit, or mentions committing code. Ensures consistent, semantic commit messages that support automated changelog generation and semantic versioning.",
      "author": {
        "name": "Alberto Leal"
      },
      "repository": "https://github.com/dashed/claude-marketplace/tree/master/plugins/conventional-commits",
      "license": "MIT",
      "keywords": [
        "git",
        "commits",
        "conventional-commits",
        "changelog",
        "semver",
        "versioning"
      ],
      "strict": false,
      "skills": [
        "./skills"
      ]
    },
    {
      "name": "git-chain",
      "version": "1.0.0",
      "source": "./plugins/git-chain",
      "description": "Manage and rebase chains of dependent Git branches (stacked branches). Use when working with multiple dependent PRs, feature branches that build on each other, or maintaining clean branch hierarchies. Automates rebasing or merging entire branch chains.",
      "author": {
        "name": "Alberto Leal"
      },
      "repository": "https://github.com/dashed/claude-marketplace/tree/master/plugins/git-chain",
      "license": "MIT",
      "keywords": [
        "git",
        "workflow",
        "branches",
        "stacked",
        "rebase",
        "merge",
        "chain",
        "dependent"
      ],
      "strict": false,
      "skills": [
        "./skills"
      ]
    },
    {
      "name": "jj",
      "version": "1.9.0",
      "source": "./plugins/jj",
      "description": "Jujutsu (jj) version control system - a Git-compatible VCS with novel features. Use when working with jj repositories, managing stacked commits, needing automatic rebasing with first-class conflict handling, using revsets to select commits, or wanting enhanced Git workflows. Triggers on mentions of 'jj', 'jujutsu', change IDs, or operation log.",
      "author": {
        "name": "Alberto Leal"
      },
      "repository": "https://github.com/dashed/claude-marketplace/tree/master/plugins/jj",
      "license": "MIT",
      "keywords": [
        "jj",
        "jujutsu",
        "vcs",
        "version-control",
        "git",
        "revsets",
        "bookmarks",
        "conflicts"
      ],
      "strict": false,
      "skills": [
        "./skills"
      ]
    },
    {
      "name": "fzf",
      "version": "1.1.1",
      "source": "./plugins/fzf",
      "description": "Command-line fuzzy finder for interactive filtering. Use when searching files, command history (CTRL-R), creating interactive menus, or integrating with ripgrep, fd, and git. Triggers on fzf, fuzzy finder, ** completion, or CTRL-T/CTRL-R/ALT-C keybindings.",
      "author": {
        "name": "Alberto Leal"
      },
      "repository": "https://github.com/dashed/claude-marketplace/tree/master/plugins/fzf",
      "license": "MIT",
      "keywords": [
        "fzf",
        "fuzzy",
        "search",
        "filter",
        "interactive",
        "shell",
        "cli",
        "completion"
      ],
      "strict": false,
      "skills": [
        "./skills"
      ]
    },
    {
      "name": "playwright",
      "version": "1.0.0",
      "source": "./plugins/playwright",
      "description": "Browser automation with Playwright for Python. Use when testing websites, taking screenshots, filling forms, scraping web content, or automating browser interactions. Triggers on browser, web testing, screenshots, selenium, puppeteer, or playwright.",
      "author": {
        "name": "Alberto Leal"
      },
      "repository": "https://github.com/dashed/claude-marketplace/tree/master/plugins/playwright",
      "license": "MIT",
      "keywords": [
        "playwright",
        "browser",
        "automation",
        "testing",
        "screenshots",
        "web",
        "scraping",
        "python"
      ],
      "strict": false,
      "skills": [
        "./skills"
      ]
    },
    {
      "name": "zellij",
      "version": "1.0.0",
      "source": "./plugins/zellij",
      "description": "Terminal workspace and multiplexer for interactive CLI sessions. Use when managing terminal sessions, running interactive REPLs, debugging, automating terminal workflows, or when user mentions zellij, floating panes, or session layouts. Simpler alternative to tmux.",
      "author": {
        "name": "Alberto Leal"
      },
      "repository": "https://github.com/dashed/claude-marketplace/tree/master/plugins/zellij",
      "license": "MIT",
      "keywords": [
        "zellij",
        "terminal",
        "multiplexer",
        "workspace",
        "panes",
        "tabs",
        "layouts",
        "interactive",
        "sessions"
      ],
      "strict": false,
      "skills": [